{
  "artifact_id": "RA_HORMUZ_DISRUPTION",
  "artifact_version": "2.1.0",
  "event_id": "EVT_HORMUZ_DISRUPTION",
  "created_at": "2026-03-01T12:00:00Z",
  "as_of_time": "2026-03-01T12:00:00Z",
  "query": "Hormuz disruption",
  "intent": "geopolitical_energy_disruption",
  "primary_profile_id": "P10",
  "profile_ids": [
    "P10",
    "P01",
    "P02"
  ],
  "roles": [
    "WORLD",
    "FINANCE",
    "COMMODITY",
    "ENERGY"
  ],
  "role_weights": {
    "WORLD": 0.25,
    "ENERGY": 0.35,
    "COMMODITY": 0.3,
    "FINANCE": 0.1
  },
  "methodologies": [
    {
      "id": "M03",
      "version": "1.2.0",
      "provenance_class": "OFFICIAL",
      "execution_class": "COMPOSITE",
      "methodology_version_hash": "79f4170772e65be589bef14c59b3a81c3160610433cea91fb64046e341fd1420",
      "trace_state": "EXECUTED"
    },
    {
      "id": "M15",
      "version": "1.2.0",
      "provenance_class": "OFFICIAL",
      "execution_class": "DIRECT_API",
      "methodology_version_hash": "5026b79b1efc15a032bb9d087063afdb71917d8acbac2d3931a42db7a07bf51c",
      "trace_state": "EXECUTED"
    },
    {
      "id": "M16",
      "version": "1.2.0",
      "provenance_class": "OFFICIAL",
      "execution_class": "DIRECT_API",
      "methodology_version_hash": "b7a1cfb35328906d98968fe9573ae23d6677af57a0ce7319355e9157ea9d1c16",
      "trace_state": "EXECUTED"
    },
    {
      "id": "M20",
      "version": "1.2.0",
      "provenance_class": "OFFICIAL",
      "execution_class": "DIRECT_API",
      "methodology_version_hash": "b109322e4e638927ded2150796425da1d0c2916f91712f1aa524a00a318d25dd",
      "trace_state": "EXECUTED"
    },
    {
      "id": "M21",
      "version": "1.2.0",
      "provenance_class": "OFFICIAL",
      "execution_class": "DIRECT_API",
      "methodology_version_hash": "5a7a7074042867f65856ed85978bb038cc5339f2c9c36a2129600d1740c58654",
      "trace_state": "EXECUTED"
    },
    {
      "id": "C03",
      "version": "1.2.0",
      "provenance_class": "OFFICIAL",
      "execution_class": "COMPOSITE",
      "methodology_version_hash": "abd8caae5e1b328ae0e9456be928508c5c1619316721d867d50a5f2a5b81cf25",
      "trace_state": "EXECUTED"
    },
    {
      "id": "C04",
      "version": "1.2.0",
      "provenance_class": "OFFICIAL",
      "execution_class": "COMPOSITE",
      "methodology_version_hash": "e41c12f98a694c7066ae2878a3ef97b8f3dce3e7ac8f164d9fc82caad030fc6f",
      "trace_state": "EXECUTED"
    },
    {
      "id": "C06",
      "version": "1.2.0",
      "provenance_class": "OFFICIAL",
      "execution_class": "GOVERNANCE",
      "methodology_version_hash": "a61663cdeab04d522c4b7c0d1aaf16bed2fe1d20547c1ccda66a4e55b8462ec7",
      "trace_state": "GOVERNANCE_TRACE"
    },
    {
      "id": "C07",
      "version": "1.2.0",
      "provenance_class": "OFFICIAL",
      "execution_class": "GOVERNANCE",
      "methodology_version_hash": "c8f1535e87fca9bb57518afb4bc713f25b8d590bfb4c30f7b6299a6c45ce1da9",
      "trace_state": "GOVERNANCE_TRACE"
    }
  ],
  "apis": [
    {
      "service": "SupplyChainService",
      "operation": "GetCountryVulnerabilities",
      "contract_version": "1.0.0",
      "request_contract_ref": "docs/api/worldmonitor.openapi.yaml#GetCountryVulnerabilities:GET:/api/supply-chain/v1/get-country-vulnerabilities",
      "request_body_schema_ref": "NOT_APPLICABLE",
      "called_at": null,
      "primary_delivery_mode": "REQUEST",
      "cache_semantics": "CACHED_FETCH",
      "delivery_binding_state": "VERIFIED",
      "cache_binding_state": "VERIFIED",
      "a23_state": "BLOCKED_AUTH",
      "a24_state": "BLOCKED",
      "live_observation": false
    },
    {
      "service": "SupplyChainService",
      "operation": "ListVulnerabilityRankings",
      "contract_version": "1.0.0",
      "request_contract_ref": "docs/api/worldmonitor.openapi.yaml#ListVulnerabilityRankings:GET:/api/supply-chain/v1/list-vulnerability-rankings",
      "request_body_schema_ref": "NOT_APPLICABLE",
      "called_at": null,
      "primary_delivery_mode": "REQUEST",
      "cache_semantics": "CACHED_FETCH",
      "delivery_binding_state": "VERIFIED",
      "cache_binding_state": "VERIFIED",
      "a23_state": "BLOCKED_AUTH",
      "a24_state": "BLOCKED",
      "live_observation": false
    },
    {
      "service": "SupplyChainService",
      "operation": "GetChokepointDependencies",
      "contract_version": "1.0.0",
      "request_contract_ref": "docs/api/worldmonitor.openapi.yaml#GetChokepointDependencies:GET:/api/supply-chain/v1/get-chokepoint-dependencies",
      "request_body_schema_ref": "NOT_APPLICABLE",
      "called_at": null,
      "primary_delivery_mode": "REQUEST",
      "cache_semantics": "CACHED_FETCH",
      "delivery_binding_state": "VERIFIED",
      "cache_binding_state": "VERIFIED",
      "a23_state": "BLOCKED_AUTH",
      "a24_state": "BLOCKED",
      "live_observation": false
    },
    {
      "service": "SupplyChainService",
      "operation": "GetChokepointHistory",
      "contract_version": "1.0.0",
      "request_contract_ref": "docs/api/worldmonitor.openapi.yaml#GetChokepointHistory:GET:/api/supply-chain/v1/get-chokepoint-history",
      "request_body_schema_ref": "NOT_APPLICABLE",
      "called_at": null,
      "primary_delivery_mode": "REQUEST",
      "cache_semantics": "CACHED_FETCH",
      "delivery_binding_state": "VERIFIED",
      "cache_binding_state": "VERIFIED",
      "a23_state": "BLOCKED_AUTH",
      "a24_state": "BLOCKED",
      "live_observation": false
    },
    {
      "service": "SupplyChainService",
      "operation": "GetChokepointStatus",
      "contract_version": "1.0.0",
      "request_contract_ref": "docs/api/worldmonitor.openapi.yaml#GetChokepointStatus:GET:/api/supply-chain/v1/get-chokepoint-status",
      "request_body_schema_ref": "NOT_APPLICABLE",
      "called_at": null,
      "primary_delivery_mode": "REQUEST",
      "cache_semantics": "CACHED_FETCH",
      "delivery_binding_state": "VERIFIED",
      "cache_binding_state": "VERIFIED",
      "a23_state": "BLOCKED_AUTH",
      "a24_state": "BLOCKED",
      "live_observation": false
    },
    {
      "service": "SupplyChainService",
      "operation": "GetCountryChokepointIndex",
      "contract_version": "1.0.0",
      "request_contract_ref": "docs/api/worldmonitor.openapi.yaml#GetCountryChokepointIndex:GET:/api/supply-chain/v1/get-country-chokepoint-index",
      "request_body_schema_ref": "NOT_APPLICABLE",
      "called_at": null,
      "primary_delivery_mode": "REQUEST",
      "cache_semantics": "CACHED_FETCH",
      "delivery_binding_state": "VERIFIED",
      "cache_binding_state": "VERIFIED",
      "a23_state": "BLOCKED_AUTH",
      "a24_state": "BLOCKED",
      "live_observation": false
    },
    {
      "service": "SupplyChainService",
      "operation": "ListEnergyDisruptions",
      "contract_version": "1.0.0",
      "request_contract_ref": "docs/api/worldmonitor.openapi.yaml#ListEnergyDisruptions:GET:/api/supply-chain/v1/list-energy-disruptions",
      "request_body_schema_ref": "NOT_APPLICABLE",
      "called_at": null,
      "primary_delivery_mode": "REQUEST",
      "cache_semantics": "CACHED_FETCH",
      "delivery_binding_state": "VERIFIED",
      "cache_binding_state": "VERIFIED",
      "a23_state": "BLOCKED_AUTH",
      "a24_state": "BLOCKED",
      "live_observation": false
    },
    {
      "service": "IntelligenceService",
      "operation": "GetCountryRisk",
      "contract_version": "1.0.0",
      "request_contract_ref": "docs/api/worldmonitor.openapi.yaml#GetCountryRisk:GET:/api/intelligence/v1/get-country-risk",
      "request_body_schema_ref": "NOT_APPLICABLE",
      "called_at": null,
      "primary_delivery_mode": "REQUEST",
      "cache_semantics": "CACHED_FETCH",
      "delivery_binding_state": "VERIFIED",
      "cache_binding_state": "VERIFIED",
      "a23_state": "BLOCKED_AUTH",
      "a24_state": "BLOCKED",
      "live_observation": false
    },
    {
      "service": "IntelligenceService",
      "operation": "GetRiskScores",
      "contract_version": "1.0.0",
      "request_contract_ref": "docs/api/worldmonitor.openapi.yaml#GetRiskScores:GET:/api/intelligence/v1/get-risk-scores",
      "request_body_schema_ref": "NOT_APPLICABLE",
      "called_at": null,
      "primary_delivery_mode": "REQUEST",
      "cache_semantics": "CACHED_FETCH",
      "delivery_binding_state": "VERIFIED",
      "cache_binding_state": "VERIFIED",
      "a23_state": "BLOCKED_AUTH",
      "a24_state": "BLOCKED",
      "live_observation": false
    },
    {
      "service": "MaritimeService",
      "operation": "GetVesselSnapshot",
      "contract_version": "1.0.0",
      "request_contract_ref": "docs/api/worldmonitor.openapi.yaml#GetVesselSnapshot:GET:/api/maritime/v1/get-vessel-snapshot",
      "request_body_schema_ref": "NOT_APPLICABLE",
      "called_at": null,
      "primary_delivery_mode": "REQUEST",
      "cache_semantics": "CACHED_FETCH",
      "delivery_binding_state": "VERIFIED",
      "cache_binding_state": "VERIFIED",
      "a23_state": "BLOCKED_AUTH",
      "a24_state": "BLOCKED",
      "live_observation": false
    },
    {
      "service": "SeismologyService",
      "operation": "ListEarthquakes",
      "contract_version": "1.0.0",
      "request_contract_ref": "docs/api/worldmonitor.openapi.yaml#ListEarthquakes:GET:/api/seismology/v1/list-earthquakes",
      "request_body_schema_ref": "NOT_APPLICABLE",
      "called_at": null,
      "primary_delivery_mode": "REQUEST",
      "cache_semantics": "CACHED_FETCH",
      "delivery_binding_state": "VERIFIED",
      "cache_binding_state": "VERIFIED",
      "a23_state": "BLOCKED_AUTH",
      "a24_state": "BLOCKED",
      "live_observation": false
    },
    {
      "service": "MilitaryService",
      "operation": "ListMilitaryFlights",
      "contract_version": "1.0.0",
      "request_contract_ref": "docs/api/worldmonitor.openapi.yaml#ListMilitaryFlights:GET:/api/military/v1/list-military-flights",
      "request_body_schema_ref": "NOT_APPLICABLE",